{
  "$schema": "http://json-schema.org/draft-07/schema#",
  "id": "https://de4l.io/json/timmi/schema-2-1-2.json",
  "type": "object",
  "properties": {
    "geoPoint": {
      "type": "object",
      "properties": {
        "lat": {
          "type": "number"
        },
        "lon": {
          "type": "number"
        }
      },
      "required": [
        "lat",
        "lon"
      ]
    },
    "detectedActivity": {
      "type": "object"
    },
    "coords": {
      "type": "object",
      "properties": {
        "altitude": {
          "type": "number"
        },
        "bearing": {
          "type": "number"
        },
        "speed": {
          "type": "number"
        },
        "speedAccuracyMetersPerSecond": {
          "type": "number"
        },
        "lat": {
          "type": "number"
        },
        "lon": {
          "type": "number"
        }
      },
      "required": [
        "lat",
        "lon"
      ]
    },
    "deviceInfo": {
      "type": "object",
      "properties": {
        "android_id": {
          "type": "string"
        },
        "manufacturer": {
          "type": "string"
        },
        "model": {
          "type": "string"
        },
        "device": {
          "type": "string"
        }
      },
      "required": [
        "android_id"
      ]
    },
    "appInfo": {
      "type": "object",
      "properties": {
        "version": {
          "type": "string"
        },
        "versionCode": {
          "type": "number"
        },
        "packageName": {
          "type": "string"
        }
      },
      "required": [
        "version",
        "versionCode",
        "packageName"
      ]
    },
    "timestamp": {
      "type": "string"
    },
    "schemaVersion": {
      "type": "string"
    },
    "acceleration": {
      "type": "object",
      "properties": {
        "vendor": {
          "type": "string"
        },
        "name": {
          "type": "string"
        },
        "additionalProperties": {
          "type": "object",
          "properties": {
            "type": {
              "type": "number"
            },
            "maximumRange": {
              "type": "number"
            },
            "power": {
              "type": "number"
            },
            "resolution": {
              "type": "number"
            },
            "version": {
              "type": "number"
            },
            "id": {
              "type": "number"
            },
            "highestDirectReportRateLevel": {
              "type": "number"
            }
          }
        },
        "firstSensorTimestampNanos": {
          "type": "number"
        },
        "firstTimestamp": {
          "type": "string"
        },
        "lastSensorTimestampNanos": {
          "type": "number"
        },
        "lastTimestamp": {
          "type": "string"
        },
        "numberOfAggregatedValues": {
          "type": "integer"
        },
        "xAxis": {
          "type": "object",
          "properties": {
            "minimum": {
              "type": "number"
            },
            "maximum": {
              "type": "number"
            },
            "average": {
              "type": "number"
            }
          },
          "required": [
            "minimum",
            "maximum",
            "average"
          ]
        },
        "yAxis": {
          "type": "object",
          "properties": {
            "minimum": {
              "type": "number"
            },
            "maximum": {
              "type": "number"
            },
            "average": {
              "type": "number"
            }
          },
          "required": [
            "minimum",
            "maximum",
            "average"
          ]
        },
        "zAxis": {
          "type": "object",
          "properties": {
            "minimum": {
              "type": "number"
            },
            "maximum": {
              "type": "number"
            },
            "average": {
              "type": "number"
            }
          },
          "required": [
            "minimum",
            "maximum",
            "average"
          ]
        }
      },
      "required": [
        "vendor",
        "name",
        "additionalProperties",
        "firstSensorTimestampNanos",
        "firstTimestamp",
        "lastSensorTimestampNanos",
        "lastTimestamp",
        "numberOfAggregatedValues",
        "xAxis",
        "yAxis",
        "zAxis"
      ]
    },
    "light": {
      "type": "object",
      "properties": {
        "vendor": {
          "type": "string"
        },
        "name": {
          "type": "string"
        },
        "additionalProperties": {
          "type": "object",
          "properties": {
            "type": {
              "type": "number"
            },
            "maximumRange": {
              "type": "number"
            },
            "power": {
              "type": "number"
            },
            "resolution": {
              "type": "number"
            },
            "version": {
              "type": "number"
            },
            "id": {
              "type": "number"
            },
            "highestDirectReportRateLevel": {
              "type": "number"
            }
          }
        },
        "firstSensorTimestampNanos": {
          "type": "number"
        },
        "firstTimestamp": {
          "type": "string"
        },
        "lastSensorTimestampNanos": {
          "type": "number"
        },
        "lastTimestamp": {
          "type": "string"
        },
        "numberOfAggregatedValues": {
          "type": "number"
        },
        "lux": {
          "type": "object",
          "properties": {
            "minimum": {
              "type": "number"
            },
            "maximum": {
              "type": "number"
            },
            "average": {
              "type": "number"
            }
          }
        }
      }
    }
  },
  "required": [
    "geoPoint",
    "coords",
    "deviceInfo",
    "appInfo",
    "timestamp",
    "schemaVersion",
    "acceleration"
  ]
}
